{
  "$schema": "https://json-schema.org/draft/2020-12/schema",
  "$id": "https://quotaarc.local/schema/v1/summary.schema.json",
  "title": "QuotaArc v1 summary",
  "description": "Sanitized mobile read model. Cross-field invariants are also enforced by assertQuotaArcSummary.",
  "type": "object",
  "additionalProperties": false,
  "required": [
    "schemaVersion",
    "generatedAt",
    "stale",
    "sources",
    "quota",
    "accountUsage",
    "localUsage"
  ],
  "properties": {
    "schemaVersion": { "const": 1 },
    "generatedAt": { "$ref": "#/$defs/isoTimestamp" },
    "stale": {
      "type": "boolean",
      "description": "True exactly when at least one source status is stale."
    },
    "sources": {
      "type": "object",
      "additionalProperties": false,
      "required": ["quota", "accountUsage", "localUsage"],
      "properties": {
        "quota": { "$ref": "#/$defs/appServerSource" },
        "accountUsage": { "$ref": "#/$defs/appServerSource" },
        "localUsage": { "$ref": "#/$defs/localUsageSource" }
      }
    },
    "quota": {
      "type": "object",
      "additionalProperties": false,
      "required": ["limits"],
      "properties": {
        "limits": {
          "type": "array",
          "items": { "$ref": "#/$defs/quotaLimit" }
        }
      }
    },
    "accountUsage": {
      "type": "object",
      "additionalProperties": false,
      "required": ["dailyTokens"],
      "properties": {
        "dailyTokens": {
          "type": "array",
          "items": { "$ref": "#/$defs/accountDailyTokenUsage" }
        }
      }
    },
    "localUsage": { "$ref": "#/$defs/localUsageSummary" }
  },
  "$defs": {
    "isoTimestamp": {
      "type": "string",
      "pattern": "^\\d{4}-\\d{2}-\\d{2}T\\d{2}:\\d{2}:\\d{2}(?:\\.\\d{1,9})?(?:Z|[+-]\\d{2}:\\d{2})$"
    },
    "nullableIsoTimestamp": {
      "oneOf": [{ "$ref": "#/$defs/isoTimestamp" }, { "type": "null" }]
    },
    "isoDate": {
      "type": "string",
      "pattern": "^\\d{4}-\\d{2}-\\d{2}$"
    },
    "sourceStatus": {
      "enum": ["ok", "stale", "unavailable", "unsupported", "error"]
    },
    "sourceError": {
      "type": "object",
      "additionalProperties": false,
      "required": ["code", "message", "retryable"],
      "properties": {
        "code": {
          "type": "string",
          "minLength": 1,
          "maxLength": 80,
          "pattern": "^[a-z0-9][a-z0-9_.-]*$"
        },
        "message": { "$ref": "#/$defs/safeClientString320" },
        "retryable": { "type": "boolean" }
      }
    },
    "nullableSourceError": {
      "oneOf": [{ "$ref": "#/$defs/sourceError" }, { "type": "null" }]
    },
    "appServerSource": {
      "type": "object",
      "additionalProperties": false,
      "required": ["kind", "status", "collectedAt", "error"],
      "properties": {
        "kind": { "const": "codex_app_server" },
        "status": { "$ref": "#/$defs/sourceStatus" },
        "collectedAt": { "$ref": "#/$defs/nullableIsoTimestamp" },
        "error": { "$ref": "#/$defs/nullableSourceError" }
      }
    },
    "localUsageSource": {
      "type": "object",
      "additionalProperties": false,
      "required": ["kind", "status", "collectedAt", "error", "coverage"],
      "properties": {
        "kind": { "const": "codex_session_logs" },
        "status": { "$ref": "#/$defs/sourceStatus" },
        "collectedAt": { "$ref": "#/$defs/nullableIsoTimestamp" },
        "error": { "$ref": "#/$defs/nullableSourceError" },
        "coverage": {
          "type": "object",
          "additionalProperties": false,
          "required": ["files", "firstEventAt", "lastEventAt"],
          "properties": {
            "files": { "$ref": "#/$defs/nonNegativeInteger" },
            "firstEventAt": { "$ref": "#/$defs/nullableIsoTimestamp" },
            "lastEventAt": { "$ref": "#/$defs/nullableIsoTimestamp" }
          }
        }
      }
    },
    "nonNegativeInteger": {
      "type": "integer",
      "minimum": 0,
      "maximum": 9007199254740991
    },
    "tokenCounts": {
      "type": "object",
      "required": [
        "newInputTokens",
        "cachedInputTokens",
        "outputTokens",
        "reasoningTokens"
      ],
      "properties": {
        "newInputTokens": { "$ref": "#/$defs/nonNegativeInteger" },
        "cachedInputTokens": { "$ref": "#/$defs/nonNegativeInteger" },
        "outputTokens": { "$ref": "#/$defs/nonNegativeInteger" },
        "reasoningTokens": { "$ref": "#/$defs/nonNegativeInteger" }
      }
    },
    "quotaWindow": {
      "type": "object",
      "additionalProperties": false,
      "required": [
        "windowMinutes",
        "usedPercent",
        "remainingPercent",
        "resetsAt"
      ],
      "properties": {
        "windowMinutes": {
          "type": "integer",
          "minimum": 1,
          "maximum": 9007199254740991
        },
        "usedPercent": { "type": "number", "minimum": 0, "maximum": 100 },
        "remainingPercent": {
          "type": "number",
          "minimum": 0,
          "maximum": 100
        },
        "resetsAt": { "$ref": "#/$defs/isoTimestamp" }
      }
    },
    "quotaLimit": {
      "type": "object",
      "additionalProperties": false,
      "required": ["limitId", "limitName", "windows"],
      "properties": {
        "limitId": { "$ref": "#/$defs/safeClientString160" },
        "limitName": {
          "oneOf": [
            { "$ref": "#/$defs/safeClientString160" },
            { "type": "null" }
          ]
        },
        "windows": {
          "type": "array",
          "minItems": 1,
          "items": { "$ref": "#/$defs/quotaWindow" }
        }
      }
    },
    "accountDailyTokenUsage": {
      "type": "object",
      "additionalProperties": false,
      "required": ["date", "tokens"],
      "properties": {
        "date": { "$ref": "#/$defs/isoDate" },
        "tokens": { "$ref": "#/$defs/nonNegativeInteger" }
      }
    },
    "usageBreakdown": {
      "type": "object",
      "additionalProperties": false,
      "required": [
        "id",
        "label",
        "newInputTokens",
        "cachedInputTokens",
        "outputTokens",
        "reasoningTokens"
      ],
      "properties": {
        "id": { "$ref": "#/$defs/safeClientString160" },
        "label": { "$ref": "#/$defs/safeClientString160" },
        "newInputTokens": { "$ref": "#/$defs/nonNegativeInteger" },
        "cachedInputTokens": { "$ref": "#/$defs/nonNegativeInteger" },
        "outputTokens": { "$ref": "#/$defs/nonNegativeInteger" },
        "reasoningTokens": { "$ref": "#/$defs/nonNegativeInteger" }
      }
    },
    "unsafeClientText": {
      "type": "string",
      "anyOf": [
        {
          "pattern": "(?:\\b(?:sk|sess)-[A-Za-z0-9_-]{12,}\\b|\\bBearer\\s+[A-Za-z0-9._~-]{12,})"
        },
        {
          "pattern": "(?:^|[\\s(\"'=:])/(?!/)[^\\s/]+(?:/[^\\s/]+)*"
        },
        {
          "pattern": "(?:^|[\\s(\"'=])//[^\\s/]+/[^\\s/]+"
        },
        {
          "pattern": "(?:^|[\\s(\"'=])[A-Za-z]:\\\\[^\\s\\\\]+(?:\\\\[^\\s\\\\]+)*"
        },
        {
          "pattern": "(?:^|[\\s(\"'=])\\\\\\\\[^\\\\\\s]+\\\\[^\\\\\\s]+"
        },
        {
          "pattern": "(?:^|[\\s(\"'=])~[/\\\\][^\\s/\\\\]+"
        },
        { "pattern": "\\bfile://+" }
      ]
    },
    "safeClientString160": {
      "type": "string",
      "minLength": 1,
      "maxLength": 160,
      "not": { "$ref": "#/$defs/unsafeClientText" }
    },
    "safeClientString320": {
      "type": "string",
      "minLength": 1,
      "maxLength": 320,
      "not": { "$ref": "#/$defs/unsafeClientText" }
    },
    "localUsageSummary": {
      "type": "object",
      "additionalProperties": false,
      "required": [
        "period",
        "newInputTokens",
        "cachedInputTokens",
        "outputTokens",
        "reasoningTokens",
        "models",
        "projects"
      ],
      "properties": {
        "period": { "enum": ["today", "week", "month"] },
        "newInputTokens": { "$ref": "#/$defs/nonNegativeInteger" },
        "cachedInputTokens": { "$ref": "#/$defs/nonNegativeInteger" },
        "outputTokens": { "$ref": "#/$defs/nonNegativeInteger" },
        "reasoningTokens": { "$ref": "#/$defs/nonNegativeInteger" },
        "models": {
          "type": "array",
          "items": { "$ref": "#/$defs/usageBreakdown" }
        },
        "projects": {
          "type": "array",
          "items": { "$ref": "#/$defs/usageBreakdown" }
        }
      }
    }
  }
}
