{
  "schemaVersion": 1,
  "generatedAt": "2026-07-19T09:00:00Z",
  "stale": true,
  "sources": {
    "quota": {
      "kind": "codex_app_server",
      "status": "ok",
      "collectedAt": "2026-07-19T08:59:58Z",
      "error": null
    },
    "accountUsage": {
      "kind": "codex_app_server",
      "status": "unsupported",
      "collectedAt": null,
      "error": null
    },
    "localUsage": {
      "kind": "codex_session_logs",
      "status": "stale",
      "collectedAt": "2026-07-19T07:30:00Z",
      "error": {
        "code": "source.read_failed",
        "message": "Session metadata could not be refreshed.",
        "retryable": true
      },
      "coverage": {
        "files": 2,
        "firstEventAt": "2026-07-18T03:00:00Z",
        "lastEventAt": "2026-07-19T07:29:00Z"
      }
    }
  },
  "quota": {
    "limits": [
      {
        "limitId": "codex",
        "limitName": null,
        "windows": [
          {
            "windowMinutes": 10080,
            "usedPercent": 40,
            "remainingPercent": 60,
            "resetsAt": "2026-07-25T00:00:00Z"
          }
        ]
      }
    ]
  },
  "accountUsage": {
    "dailyTokens": []
  },
  "localUsage": {
    "period": "today",
    "newInputTokens": 0,
    "cachedInputTokens": 0,
    "outputTokens": 0,
    "reasoningTokens": 0,
    "models": [],
    "projects": []
  }
}
